Opp,,Ranks,,Rushing,,,Receiving,,,numberFire,,DraftKings,,,
Player,Team,Def Rank,Ovr,Pos,Att,Yds,TDs,Rec,Yds,TDs,CI,FP,FP,Cost,Value
"Calvin Johnson (WR, DET)",NE,#9,34,1,0.00,0.00,0.00,6.10,96.21,0.52,3.82-21.66,12.74,18.88,$7800,2.42
"Jordy Nelson (WR, GB)",MIN,#15,35,2,0.00,0.00,0.00,5.82,83.72,0.73,5.03-20.29,12.66,18.57,$8300,2.24
"Brandon Marshall (WR, CHI)",TB,#28,36,3,0.08,0.72,0.00,5.93,92.41,0.48,5.06-19.16,12.11,18.08,$7100,2.55
"Randall Cobb (WR, GB)",MIN,#15,37,4,0.04,0.24,0.00,5.63,82.39,0.66,5.42-18.76,12.09,17.81,$7600,2.34
"Dez Bryant (WR, DAL)",NYG,#20,38,5,0.00,0.00,0.00,6.02,76.49,0.68,5.01-18.47,11.74,17.79,$8100,2.2
"Julio Jones (WR, ATL)",CLE,#18,39,6,0.04,0.08,0.00,5.97,78.33,0.66,5.57-17.89,11.73,17.78,$7000,2.54
"Demaryius Thomas (WR, DEN)",MIA,#1,40,7,0.00,0.00,0.00,6.20,88.03,0.49,3.98-19.18,11.58,17.86,$8700,2.05
"A.J. Green (WR, CIN)",HOU,#4,41,8,0.12,0.55,0.00,6.17,93.45,0.39,1.76-21.18,11.47,17.79,$7300,2.44
"Jeremy Maclin (WR, PHI)",TEN,#27,41,8,0.00,0.00,0.00,5.12,77.71,0.62,4.66-18.28,11.47,16.69,$7900,2.11
"Alshon Jeffery (WR, CHI)",TB,#28,42,9,0.12,0.70,0.00,5.97,89.62,0.40,5.72-17.12,11.42,17.41,$7200,2.42
"Golden Tate (WR, DET)",NE,#9,51,10,0.16,0.50,0.00,5.25,69.54,0.52,4.58-15.36,9.97,15.28,$6900,2.21
"T.Y. Hilton (WR, IND)",JAC,#19,52,11,0.04,0.12,0.00,4.55,66.86,0.55,3.39-16.45,9.92,14.55,$7600,1.91
"Odell Beckham (WR, NYG)",DAL,#16,53,12,0.15,1.95,0.00,5.09,70.79,0.45,3.93-15.85,9.89,15.02,$6100,2.46
"Julian Edelman (WR, NE)",DET,#2,55,13,0.30,1.55,0.00,6.47,74.61,0.38,4.32-15.3,9.81,16.36,$6000,2.73
"Steve Smith (WR, BAL)",NO,#31,56,14,0.00,0.00,0.00,5.24,74.75,0.39,3.97-15.61,9.79,15.1,$4800,3.15
"Mike Wallace (WR, MIA)",DEN,#10,59,15,0.09,-0.24,0.00,5.34,72.09,0.43,2.09-17.07,9.58,15.02,$4900,3.07
"Mike Evans (WR, TB)",CHI,#30,61,16,0.00,0.00,0.00,5.42,72.76,0.38,4.04-15.06,9.55,15.02,$7800,1.93
"Sammy Watkins (WR, BUF)",NYJ,#24,62,17,0.12,0.16,0.00,4.26,65.17,0.48,4.51-14.21,9.36,13.69,$5600,2.44
"Marques Colston (WR, NO)",BAL,#5,66,18,0.00,0.00,0.00,4.25,65.60,0.44,2.11-16.21,9.16,13.47,$4200,3.21
"Roddy White (WR, ATL)",CLE,#18,67,19,0.00,0.00,0.00,5.19,72.14,0.33,4.01-14.19,9.10,14.38,$6200,2.32
"Anquan Boldin (WR, SF)",WSH,#22,69,20,0.00,0.00,0.00,5.05,65.78,0.43,4.09-14.07,9.08,14.17,$5200,2.73
"Percy Harvin (WR, NYJ)",BUF,#7,70,21,0.88,6.69,0.09,5.56,57.20,0.35,1.39-16.57,8.98,14.57,$4700,3.1
"Andre Johnson (WR, HOU)",CIN,#21,72,22,0.00,0.00,0.00,5.78,66.04,0.37,2.94-14.66,8.80,14.58,$5200,2.8
"DeSean Jackson (WR, WSH)",SF,#8,74,23,0.14,0.75,0.00,3.53,58.82,0.46,2.72-14.74,8.73,12.25,$6500,1.88
"Keenan Allen (WR, SD)",STL,#17,75,24,0.00,0.00,0.00,5.27,65.71,0.33,2.97-14.37,8.67,13.98,$4900,2.85
"Emmanuel Sanders (WR, DEN)",MIA,#1,76,25,0.14,1.83,0.00,4.52,62.95,0.37,2.95-14.37,8.66,13.24,$8000,1.66
"Reggie Wayne (WR, IND)",JAC,#19,77,26,0.00,0.00,0.00,4.94,62.50,0.40,1.7-15.56,8.63,13.59,$5400,2.52
"Josh Gordon (WR, CLE)",ATL,#32,78,27,0.00,0.00,0.00,4.65,67.85,0.32,3.05-14.17,8.61,13.32,$6300,2.11
"Larry Fitzgerald (WR, ARI)",SEA,#11,79,28,0.00,0.00,0.00,4.33,57.98,0.47,3.32-13.78,8.55,12.93,$5700,2.27
"Doug Baldwin (WR, SEA)",ARI,#3,82,29,0.00,0.00,0.00,5.15,62.38,0.34,1.47-15.31,8.39,13.62,$4700,2.9
"Cecil Shorts (WR, JAC)",IND,#25,83,30,0.00,0.00,0.00,5.35,73.71,0.14,1.67-14.87,8.27,13.7,$5400,2.54
"Dwayne Bowe (WR, KC)",OAK,#14,87,31,0.00,0.00,0.00,4.51,58.09,0.40,2.51-13.73,8.12,12.66,$4100,3.09
"Kenny Britt (WR, STL)",SD,#26,89,32,0.24,0.73,0.00,3.09,51.93,0.47,2.23-13.89,8.06,11.16,$4600,2.43
"Torrey Smith (WR, BAL)",NO,#31,90,33,0.00,0.00,0.00,3.48,56.38,0.41,1.66-14.42,8.04,11.56,$5400,2.14
"Brandon LaFell (WR, NE)",DET,#2,92,34,0.00,0.00,0.00,4.63,60.74,0.31,2.19-13.57,7.88,12.54,$5700,2.2
"Michael Floyd (WR, ARI)",SEA,#11,94,35,0.12,0.28,0.00,3.86,58.92,0.32,-0.11-15.69,7.79,11.72,$3900,3.01
"Michael Crabtree (WR, SF)",WSH,#22,98,36,0.08,0.06,0.00,4.38,56.37,0.32,2.33-12.85,7.59,11.94,$5000,2.39
"Eric Decker (WR, NYJ)",BUF,#7,101,37,0.00,0.00,0.00,5.42,63.78,0.17,1.55-13.19,7.37,12.86,$4600,2.8
"DeAndre Hopkins (WR, HOU)",CIN,#21,102,38,0.00,0.00,0.00,4.31,56.75,0.29,3.35-11.37,7.36,11.75,$5300,2.22
"Kendall Wright (WR, TEN)",PHI,#6,103,39,0.14,0.85,0.00,5.10,63.89,0.15,2.16-12.5,7.33,12.45,$4900,2.54
"Pierre Garcon (WR, WSH)",SF,#8,104,40,0.00,0.00,0.00,4.33,62.50,0.18,0.49-14.11,7.30,11.64,$4200,2.77
"Kenny Stills (WR, NO)",BAL,#5,105,41,0.00,0.00,0.00,3.00,41.48,0.52,0.63-13.83,7.23,10.24,$4200,2.44
"Malcom Floyd (WR, SD)",STL,#17,105,41,0.00,0.00,0.00,2.81,45.34,0.45,2.23-12.23,7.23,10.1,$4600,2.2
"Vincent Jackson (WR, TB)",CHI,#30,106,42,0.00,0.00,0.00,4.28,57.66,0.24,1.83-12.45,7.14,11.53,$5200,2.22
"Andrew Hawkins (WR, CLE)",ATL,#32,108,43,0.12,1.17,0.00,3.82,49.67,0.31,2.49-11.33,6.91,10.73,$4900,2.19
"Terrance Williams (WR, DAL)",NYG,#20,110,44,0.00,0.00,0.00,2.24,40.63,0.44,0.9-12.46,6.68,8.94,$3800,2.35
"Rueben Randle (WR, NYG)",DAL,#16,112,45,0.00,0.00,0.00,4.08,54.12,0.18,2.14-11.02,6.58,10.72,$5100,2.1
"James Jones (WR, OAK)",KC,#12,116,46,0.00,0.00,0.00,4.87,50.14,0.21,0.85-11.57,6.21,11.13,$3600,3.09
"Jordan Matthews (WR, PHI)",TEN,#27,118,47,0.00,0.00,0.00,3.85,43.43,0.27,0.84-11.06,5.95,9.87,$5500,1.79
"Wes Welker (WR, DEN)",MIA,#1,119,48,0.00,0.00,0.00,4.64,46.40,0.21,0.77-11.01,5.89,10.54,$4200,2.51
"Mohamed Sanu (WR, CIN)",HOU,#4,122,49,0.06,0.20,0.00,3.33,41.70,0.26,1.79-9.61,5.70,9.09,$5000,1.82
"Jarvis Landry (WR, MIA)",DEN,#10,123,50,0.08,-0.23,0.00,3.96,43.43,0.23,0.39-10.93,5.66,9.64,$4400,2.19
"Eddie Royal (WR, SD)",STL,#17,124,51,0.10,0.20,0.00,2.47,39.55,0.26,1.19-9.89,5.54,8.01,$3000,2.67
"Allen Hurns (WR, JAC)",IND,#25,125,52,0.00,0.00,0.00,2.53,39.11,0.26,0.5-10.44,5.47,7.99,$3200,2.5
"Cordarrelle Patterson (WR, MIN)",GB,#13,126,53,0.11,0.15,0.00,3.62,42.05,0.19,0.43-10.41,5.42,9.08,$3500,2.59
"Justin Hunter (WR, TEN)",PHI,#6,127,54,0.00,0.00,0.00,2.67,41.55,0.21,0.1-10.72,5.41,8.09,$3800,2.13
"Steve Johnson (WR, SF)",WSH,#22,128,55,0.00,0.00,0.00,2.27,36.19,0.30,1.1-9.62,5.36,7.66,$3200,2.39
"Greg Jennings (WR, MIN)",GB,#13,130,56,0.00,0.00,0.00,3.22,43.48,0.15,0.99-9.49,5.24,8.51,$3500,2.43
"Brian Hartline (WR, MIA)",DEN,#10,132,57,0.00,0.00,0.00,2.91,35.00,0.27,1.05-9.15,5.10,8.01,$3200,2.5
"Taylor Gabriel (WR, CLE)",ATL,#32,133,58,0.04,0.35,0.00,2.10,30.92,0.32,1.24-8.86,5.05,7.17,$4200,1.71
"Miles Austin (WR, CLE)",ATL,#32,135,59,0.00,0.00,0.00,2.39,35.58,0.22,1.48-8.22,4.85,7.27,$3000,2.42
"Davante Adams (WR, GB)",MIN,#15,138,60,0.00,0.00,0.00,2.99,34.32,0.18,0.75-8.21,4.48,7.5,$3100,2.42
"Andre Holmes (WR, OAK)",KC,#12,140,61,0.00,0.00,0.00,2.45,34.92,0.16,0.5-8.28,4.39,6.91,$3700,1.87
"Travis Benjamin (WR, CLE)",ATL,#32,141,62,0.01,0.04,0.00,1.49,25.70,0.30,-0.54-9.3,4.38,5.86,$3000,1.95
"John Brown (WR, ARI)",SEA,#11,144,63,0.06,0.16,0.00,1.97,31.26,0.19,0.53-8.01,4.27,6.24,$4600,1.36
"Nate Washington (WR, TEN)",PHI,#6,151,64,0.00,0.00,0.00,2.28,30.86,0.16,-0.13-8.11,3.99,6.35,$3200,1.98
"Ricardo Lockette (WR, SEA)",ARI,#3,152,65,0.12,0.08,0.00,2.08,31.08,0.14,-0.64-8.56,3.96,6.04,$3000,2.01
"Jermaine Kearse (WR, SEA)",ARI,#3,153,66,0.00,0.00,0.00,2.38,35.63,0.06,1.04-6.76,3.90,6.3,$3600,1.75
"Jeremy Ross (WR, DET)",NE,#9,159,67,0.05,-0.06,0.00,2.28,26.94,0.17,0.48-6.76,3.62,5.97,$3000,1.99
"Preston Parker (WR, NYG)",DAL,#16,166,68,0.00,0.00,0.00,1.90,25.39,0.14,0.72-6,3.36,5.28,$3000,1.76
"Tavon Austin (WR, STL)",SD,#26,168,69,1.40,7.76,0.04,2.50,19.36,0.07,-1.15-7.81,3.33,5.89,$3000,1.96
"Derek Hagan (WR, TEN)",PHI,#6,173,70,0.01,0.00,0.00,1.31,20.07,0.19,0.07-6.29,3.18,4.46,$3000,1.49
"Jarius Wright (WR, MIN)",GB,#13,176,71,0.13,1.81,0.04,2.03,20.60,0.07,-0.23-6.03,2.90,4.93,$3000,1.64
"Donte Moncrief (WR, IND)",JAC,#19,179,72,0.05,0.07,0.00,1.40,18.74,0.15,-0.43-6.03,2.80,4.2,$3000,1.4
"Brandon Tate (WR, CIN)",HOU,#4,183,73,0.14,0.16,0.00,1.59,19.42,0.13,0.22-5.18,2.70,4.3,$3000,1.43
"Brandon Lloyd (WR, SF)",WSH,#22,187,74,0.00,0.00,0.00,0.91,16.41,0.15,-0.38-5.52,2.57,3.47,$3000,1.16
"Corey Fuller (WR, DET)",NE,#9,188,75,0.00,0.00,0.00,1.15,18.38,0.12,0.05-5.01,2.53,3.75,$3000,1.25
"Louis Murphy (WR, TB)",CHI,#30,191,76,0.00,0.00,0.00,1.56,18.71,0.10,0.09-4.79,2.44,4.02,$3000,1.34
"Andre Roberts (WR, WSH)",SF,#8,192,77,0.08,0.05,0.00,1.70,21.31,0.04,0.67-4.11,2.39,4.13,$3000,1.38
"Robert Woods (WR, BUF)",NYJ,#24,193,78,0.00,0.00,0.00,1.86,18.00,0.10,0.1-4.66,2.38,4.25,$3400,1.25
"Harry Douglas (WR, ATL)",CLE,#18,194,79,0.00,0.00,0.00,1.63,18.44,0.08,-0.22-4.92,2.35,3.95,$3200,1.23
"Riley Cooper (WR, PHI)",TEN,#27,198,80,0.00,0.00,0.00,2.07,20.74,0.03,0.03-4.45,2.24,4.4,$3700,1.19
"Brandon Gibson (WR, MIA)",DEN,#10,201,81,0.00,0.00,0.00,1.43,17.74,0.07,-0.04-4.4,2.18,3.61,$3000,1.2
"Marquess Wilson (WR, CHI)",TB,#28,202,82,0.00,0.00,0.00,2.40,21.72,0.00,-0.29-4.63,2.17,4.57,$3000,1.52
"Cole Beasley (WR, DAL)",NYG,#20,203,83,0.00,0.00,0.00,1.52,16.53,0.09,-0.51-4.81,2.15,3.7,$3000,1.23
"Jeff Janis (WR, GB)",MIN,#15,204,84,0.00,0.00,0.00,1.14,18.37,0.05,0.03-4.25,2.14,3.28,$3000,1.09
"Mike Williams (WR, BUF)",NYJ,#24,207,85,0.00,0.00,0.00,1.07,12.58,0.13,-0.35-4.41,2.03,3.1,$3000,1.03
"Devin Hester (WR, ATL)",CLE,#18,207,85,0.06,0.25,0.00,1.45,15.48,0.08,-0.64-4.7,2.03,3.51,$3000,1.17
"Marqise Lee (WR, JAC)",IND,#25,210,86,0.09,0.84,0.00,1.63,16.95,0.02,0.38-3.32,1.85,3.52,$3000,1.17
"Jeremy Kerley (WR, NYJ)",BUF,#7,211,87,0.00,0.00,0.00,1.31,15.33,0.04,-0.33-3.85,1.76,3.07,$3000,1.02
"Junior Hemingway (WR, KC)",OAK,#14,212,88,0.00,0.00,0.00,1.22,14.49,0.04,-0.07-3.57,1.75,2.96,$3000,0.99
"Stedman Bailey (WR, STL)",SD,#26,214,89,0.01,0.16,0.00,1.04,13.33,0.05,-0.1-3.36,1.63,2.69,$3000,0.9
"Danny Amendola (WR, NE)",DET,#2,215,90,0.00,0.00,0.00,1.25,14.06,0.03,0.14-3,1.57,2.84,$3000,0.95
"Hakeem Nicks (WR, IND)",JAC,#19,215,90,0.00,0.00,0.00,1.61,14.24,0.03,-0.19-3.33,1.57,3.22,$3000,1.07
"Aaron Dobson (WR, NE)",DET,#2,222,91,0.00,0.00,0.00,1.14,12.50,0.03,-0.05-2.89,1.42,2.57,$3000,0.86
"Jacoby Jones (WR, BAL)",NO,#31,229,92,0.07,0.37,0.00,0.66,7.14,0.07,-0.29-2.61,1.16,1.85,$3000,0.62
"Denarius Moore (WR, OAK)",KC,#12,230,93,0.02,0.00,0.00,1.08,11.67,0.00,0.3-2,1.15,2.24,$3000,0.75
"Bruce Ellington (WR, SF)",WSH,#22,233,94,0.02,0.05,0.00,0.44,7.10,0.06,0.12-2.06,1.09,1.53,$3000,0.51
"Robert Meachem (WR, NO)",BAL,#5,237,95,0.00,0.00,0.00,0.52,7.89,0.04,-0.35-2.43,1.04,1.55,$3000,0.52
"Chris Hogan (WR, BUF)",NYJ,#24,240,96,0.00,0.00,0.00,0.48,6.29,0.06,0.15-1.83,0.99,1.47,$4600,0.32
"Eric Weems (WR, ATL)",CLE,#18,241,97,0.00,0.00,0.00,0.45,6.67,0.05,0.01-1.95,0.98,1.42,$3000,0.47
"Chris Givens (WR, STL)",SD,#26,246,98,0.01,-0.05,0.00,0.77,9.46,0.00,-0.18-2.02,0.92,1.7,$3000,0.57
"Keshawn Martin (WR, HOU)",CIN,#21,249,99,0.00,0.00,0.00,1.03,7.81,0.03,-0.18-1.96,0.89,1.95,$3000,0.65
"Dwayne Harris (WR, DAL)",NYG,#20,252,100,0.03,0.12,0.00,0.40,5.50,0.04,0.05-1.61,0.83,1.2,$3000,0.4
"Charles Johnson (WR, MIN)",GB,#13,254,101,0.00,0.00,0.00,0.44,6.44,0.03,0.07-1.53,0.80,1.26,$3500,0.36
"Chris Owusu (WR, NYJ)",BUF,#7,256,102,0.00,0.00,0.00,0.40,5.05,0.04,-0.05-1.55,0.75,1.15,$0,0
"Russell Shepard (WR, TB)",CHI,#30,258,103,0.00,0.00,0.00,0.36,6.12,0.02,0.04-1.4,0.72,1.09,$3000,0.36
"Devin Street (WR, DAL)",NYG,#20,260,104,0.00,0.00,0.00,0.40,5.34,0.03,-0.36-1.78,0.71,1.11,$3000,0.37
"T.J. Graham (WR, NYJ)",BUF,#7,263,105,0.00,0.00,0.00,0.22,4.35,0.04,-0.16-1.5,0.67,0.9,$3100,0.29
"Kamar Aiken (WR, BAL)",NO,#31,266,106,0.00,0.00,0.00,0.45,5.18,0.02,0.06-1.22,0.64,1.08,$3000,0.36
"Kris Durham (WR, TEN)",PHI,#6,267,107,0.00,0.00,0.00,0.42,5.35,0.02,0.05-1.21,0.63,1.08,$3000,0.36
"Jaron Brown (WR, ARI)",SEA,#11,268,108,0.01,0.04,0.00,0.33,4.02,0.04,-0.01-1.25,0.62,0.98,$3000,0.33
"Rishard Matthews (WR, MIA)",DEN,#10,270,109,0.00,0.00,0.00,0.27,4.69,0.02,-0.07-1.27,0.60,0.86,$3000,0.29
"Brian Tyms (WR, NE)",DET,#2,270,109,0.00,0.00,0.00,0.20,3.81,0.04,-0.14-1.34,0.60,0.82,$3000,0.27
"DeVier Posey (WR, HOU)",CIN,#21,270,109,0.00,0.00,0.00,0.39,4.97,0.02,-0.01-1.21,0.60,1.01,$3000,0.34
"Saalim Hakim (WR, NYJ)",BUF,#7,271,110,0.00,0.00,0.00,0.40,5.15,0.01,0.05-1.13,0.59,0.98,$3000,0.33
"Walt Powell (WR, NYJ)",BUF,#7,271,110,0.00,0.00,0.00,0.40,5.15,0.01,0.05-1.13,0.59,0.98,$3000,0.33
"Damian Williams (WR, STL)",SD,#26,271,110,0.00,0.00,0.00,0.36,5.17,0.01,-0.02-1.2,0.59,0.94,$3000,0.31
"Marquise Goodwin (WR, BUF)",NYJ,#24,272,111,0.02,0.03,0.00,0.23,4.50,0.02,-0.04-1.2,0.58,0.8,$3000,0.27
"Marcus Easley (WR, BUF)",NYJ,#24,272,111,0.00,0.00,0.00,0.37,4.76,0.02,0.02-1.14,0.58,0.97,$3000,0.32
"Santana Moss (WR, WSH)",SF,#8,273,112,0.00,0.00,0.00,0.36,4.39,0.02,-0.05-1.19,0.57,0.92,$3000,0.31
"Cody Latimer (WR, DEN)",MIA,#1,274,113,0.00,0.00,0.00,0.40,4.75,0.01,-0.03-1.13,0.55,0.94,$3000,0.31
"Chris Williams (WR, CHI)",TB,#28,275,114,0.00,0.00,0.00,0.36,4.74,0.01,0.03-1.03,0.53,0.89,$3000,0.3
"Albert Wilson (WR, KC)",OAK,#14,275,114,0.00,0.00,0.00,0.36,4.41,0.01,0.03-1.03,0.53,0.86,$3000,0.29
"Quinton Patton (WR, SF)",WSH,#22,275,114,0.00,0.00,0.00,0.33,4.50,0.01,0.02-1.04,0.53,0.84,$3000,0.28
"Rashad Ross (WR, CHI)",TB,#28,275,114,0.00,0.00,0.00,0.36,4.74,0.01,0.03-1.03,0.53,0.89,$0,0
"Trindon Holliday (WR, TB)",CHI,#30,276,115,0.00,0.00,0.00,0.36,4.37,0.01,-0.05-1.09,0.52,0.86,$0,0
"LaRon Byrd (WR, CLE)",ATL,#32,280,116,0.00,0.00,0.00,0.36,4.41,0.01,-0.06-1.04,0.49,0.86,$0,0
"Marlon Moore (WR, CLE)",ATL,#32,280,116,0.00,0.00,0.00,0.36,4.41,0.01,-0.06-1.04,0.49,0.86,$3000,0.29
"Corey Washington (WR, NYG)",DAL,#16,281,117,0.00,0.00,0.00,0.28,4.02,0.01,-0.05-1.01,0.48,0.74,$3000,0.25
"Robert Herron (WR, TB)",CHI,#30,284,118,0.01,0.04,0.00,0.33,4.29,0.00,-0.05-0.97,0.46,0.76,$3000,0.25
"Greg Salas (WR, NYJ)",BUF,#7,284,118,0.00,0.00,0.00,0.20,3.28,0.02,-0.11-1.03,0.46,0.65,$3000,0.22
"Damaris Johnson (WR, HOU)",CIN,#21,286,119,0.01,0.01,0.00,0.36,3.63,0.01,-0.12-1.02,0.45,0.78,$3000,0.26
"Matt Slater (WR, NE)",DET,#2,286,119,0.00,0.00,0.00,0.32,4.23,0.00,0.01-0.89,0.45,0.74,$0,0
"Ryan Grant (WR, WSH)",SF,#8,287,120,0.00,0.00,0.00,0.29,3.80,0.01,-0.04-0.9,0.43,0.73,$3000,0.24
"Nick Toon (WR, NO)",BAL,#5,287,120,0.00,0.00,0.00,0.32,4.03,0.00,0.01-0.85,0.43,0.72,$3000,0.24
"Ryan Broyles (WR, DET)",NE,#9,289,121,0.00,0.00,0.00,0.19,3.03,0.02,-0.12-0.94,0.41,0.61,$3000,0.2
"Jeff Maehl (WR, PHI)",TEN,#27,289,121,0.00,0.00,0.00,0.40,3.80,0.01,0.02-0.8,0.41,0.83,$3000,0.28
"Marlon Brown (WR, BAL)",NO,#31,290,122,0.00,0.00,0.00,0.38,3.58,0.01,0.01-0.79,0.40,0.8,$3000,0.27
"Paul Richardson (WR, SEA)",ARI,#3,291,123,0.00,0.00,0.00,0.37,3.11,0.01,-0.1-0.88,0.39,0.74,$3000,0.25
"Seyi Ajirotutu (WR, SD)",STL,#17,293,124,0.00,0.00,0.00,0.24,3.18,0.01,-0.12-0.86,0.37,0.62,$3000,0.21
"Josh Morgan (WR, CHI)",TB,#28,293,124,0.00,0.00,0.00,0.31,3.14,0.01,0.03-0.71,0.37,0.68,$3000,0.23
"Ted Ginn Jr. (WR, ARI)",SEA,#11,295,125,0.00,0.07,0.00,0.23,3.29,0.00,-0.1-0.82,0.36,0.57,$3000,0.19
"Adam Thielen (WR, MIN)",GB,#13,296,126,0.00,0.00,0.00,0.17,2.97,0.01,-0.08-0.78,0.35,0.53,$3000,0.18
"Griff Whalen (WR, IND)",JAC,#19,298,127,0.00,0.00,0.00,0.31,3.41,0.00,0.07-0.61,0.34,0.65,$3000,0.22
"James Wright (WR, CIN)",HOU,#4,303,128,0.01,0.04,0.00,0.17,2.27,0.01,-0.12-0.7,0.29,0.46,$3000,0.15
"Ace Sanders (WR, JAC)",IND,#25,303,128,0.00,0.00,0.00,0.42,2.79,0.01,-0.05-0.63,0.29,0.75,$3000,0.25
"Kevin Norwood (WR, SEA)",ARI,#3,303,128,0.00,0.00,0.00,0.43,2.79,0.00,-0.05-0.63,0.29,0.7,$3000,0.23
"Mike Brown (WR, JAC)",IND,#25,304,129,0.00,0.00,0.00,0.23,2.48,0.01,-0.08-0.64,0.28,0.53,$3000,0.18
"Jarrett Boykin (WR, GB)",MIN,#15,304,129,0.00,0.00,0.00,0.29,2.78,0.00,-0.11-0.67,0.28,0.57,$3000,0.19
"Dane Sanzenbacher (WR, CIN)",HOU,#4,305,130,0.00,0.00,0.00,0.33,2.68,0.00,-0.01-0.55,0.27,0.6,$3000,0.2
"Teddy Williams (WR, CHI)",TB,#28,306,131,0.00,0.00,0.00,0.18,2.37,0.00,0.01-0.51,0.26,0.42,$0,0
"Frankie Hammond (WR, KC)",OAK,#14,310,132,0.00,0.00,0.00,0.13,1.66,0.01,-0.09-0.49,0.20,0.36,$3000,0.12
"Josh Huff (WR, PHI)",TEN,#27,314,133,0.02,0.06,0.00,0.17,1.34,0.00,-0.03-0.29,0.13,0.31,$3000,0.1
"Joe Morgan (WR, NO)",BAL,#5,314,133,0.00,0.00,0.00,0.13,1.33,0.00,-0.02-0.28,0.13,0.26,$0,0
"Aldrick Robinson (WR, WSH)",SF,#8,314,133,0.00,0.00,0.00,0.12,1.30,0.00,-0.03-0.29,0.13,0.25,$3000,0.08
"Brice Butler (WR, OAK)",KC,#12,316,134,0.00,0.00,0.00,0.07,1.01,0.00,-0.01-0.23,0.11,0.17,$3000,0.06
"Andre Caldwell (WR, DEN)",MIA,#1,318,135,0.00,0.00,0.00,0.11,0.66,0.00,-0.1-0.28,0.09,0.18,$3000,0.06
"Kenbrell Thompkins (WR, OAK)",KC,#12,320,136,0.00,0.00,0.00,0.06,0.62,0.00,-0.03-0.17,0.07,0.12,$3000,0.04
"Vincent Brown (WR, OAK)",KC,#12,323,137,0.00,0.00,0.00,0.06,0.52,0.00,-0.01-0.09,0.04,0.11,$3000,0.04
"Freddie Martino (WR, ATL)",CLE,#18,326,138,0.00,0.00,0.00,0.01,0.16,0.00,-0.02-0.02,0.00,0.02,$3000,0.01
"Brenton Bersin (WR, CAR)",BYE,,326,138,0.00,0.00,0.00,0.00,0.00,0.00,0-0,0.00,0,$0,0
"Isaiah Burse (WR, DEN)",MIA,#1,326,138,0.00,0.00,0.00,0.01,0.18,0.00,-0.02-0.02,0.00,0.02,$3000,0.01
"Philly Brown (WR, CAR)",BYE,,326,138,0.00,0.00,0.00,0.00,0.00,0.00,0-0,0.00,0,$0,0
"Martavis Bryant (WR, PIT)",BYE,,326,138,0.00,0.00,0.00,0.00,0.00,0.00,0-0,0.00,0,$0,0
"Kelvin Benjamin (WR, CAR)",BYE,,326,138,0.00,0.00,0.00,0.00,0.00,0.00,0-0,0.00,0,$0,0
"Jerricho Cotchery (WR, CAR)",BYE,,326,138,0.00,0.00,0.00,0.00,0.00,0.00,0-0,0.00,0,$0,0
"Markus Wheaton (WR, PIT)",BYE,,326,138,0.00,0.00,0.00,0.00,0.00,0.00,0-0,0.00,0,$0,0
"Rod Streater (WR, OAK)",KC,#12,326,138,0.00,0.00,0.00,0.00,0.00,0.00,0-0,0.00,0,$0,0
"A.J. Jenkins (WR, KC)",OAK,#14,326,138,0.00,0.00,0.00,0.00,0.00,0.00,0-0,0.00,0,$3000,0
"Antonio Brown (WR, PIT)",BYE,,326,138,0.00,0.00,0.00,0.00,0.00,0.00,0-0,0.00,0,$0,0
"Darrius Heyward-Bey (WR, PIT)",BYE,,326,138,0.00,0.00,0.00,0.00,0.00,0.00,0-0,0.00,0,$0,0
"Lance Moore (WR, PIT)",BYE,,326,138,0.00,0.00,0.00,0.00,0.00,0.00,0-0,0.00,0,$0,0
"Brad Smith (WR, PHI)",TEN,#27,326,138,0.00,0.00,0.00,0.01,0.14,0.00,-0.02-0.02,0.00,0.01,$3000,0
"Donnie Avery (WR, KC)",OAK,#14,326,138,0.00,0.00,0.00,0.00,0.00,0.00,0-0,0.00,0,$3000,0
"Jason Avant (WR, CAR)",BYE,,326,138,0.00,0.00,0.00,0.00,0.00,0.00,0-0,0.00,0,$0,0
"Justin Brown (WR, PIT)",BYE,,326,138,0.00,0.00,0.00,0.00,0.00,0.00,0-0,0.00,0,$0,0